{
  "schema": "proof-forge.benchmark-result.v1",
  "schemaVersion": 1,
  "scenario": "bm-counter",
  "target": "evm",
  "implementation": "proofforge",
  "commit": "deadbeefcafebabe",
  "toolVersions": {
    "proof-forge": "dev",
    "solc": "0.8.30"
  },
  "behavior": {
    "ok": true,
    "steps": [
      { "name": "initialize", "return": null },
      { "name": "increment", "return": null },
      { "name": "get", "return": "1" }
    ]
  },
  "costs": {
    "evm_gas": {
      "initialize": 42000,
      "increment": 26000,
      "get": 2400
    }
  },
  "artifactBytes": 180,
  "notes": "fixture for schema checker"
}
