{
  "schema": "proof-forge.benchmark-result.v1",
  "schemaVersion": 1,
  "scenario": "bm-counter",
  "target": "wasm-near",
  "implementation": "native",
  "commit": "deadbeefcafebabe",
  "toolVersions": {},
  "behavior": {
    "ok": false,
    "steps": []
  },
  "costs": {},
  "artifactBytes": 0,
  "notes": "near-sdk toolchain not installed; honest skip"
}
