{
  "schema": "proof-forge.benchmark-result.v1",
  "schemaVersion": 1,
  "scenario": "bm-counter",
  "target": "solana-sbpf-asm",
  "implementation": "native",
  "commit": "deadbeefcafebabe",
  "toolVersions": {
    "sbpf": "dev"
  },
  "behavior": {
    "ok": true,
    "steps": [
      { "name": "initialize", "return": null },
      { "name": "increment", "return": null },
      { "name": "get", "return": "1" }
    ]
  },
  "costs": {
    "solana_cu": {
      "initialize": 1200,
      "increment": 800,
      "get": 400
    }
  },
  "artifactBytes": 4096,
  "notes": "Pinocchio-class native baseline (fixture)"
}
